<?xml version="1.0" encoding="UTF-8"?>
<!--
===============================================================================

  Copyright (c) 2014 Qualcomm Technologies, Inc. All Rights Reserved.
  Qualcomm Technologies Proprietary and Confidential.

===============================================================================
-->

<tns:debugpolicy xmlns:tns="http://www.qualcomm.com/debugpolicy"
        xmlns:xsi="http://www.w3.org/2001/XMLSchema-instance"
        xsi:schemaLocation="http://www.qualcomm.com/debugpolicy ../xsd/debugpolicy.xsd">

    <metadata>
        <chipset>8952</chipset>
        <version>1.0</version>
    </metadata>

    <file_properties>
        <revision>1</revision>

        <serial_number_start>0</serial_number_start>
        <serial_number_end>0</serial_number_end>

        <flags>
            <flag> <bit_pos>0</bit_pos> <value>0</value> </flag> <!--DP_ENABLE_ONLINE_CRASH_DUMPS-->
            <flag> <bit_pos>1</bit_pos> <value>0</value> </flag> <!--DP_ENABLE_OFFLINE_CRASH_DUMPS-->
            <flag> <bit_pos>4</bit_pos> <value>0</value> </flag> <!--DP_ENABLE_LOGS-->
        </flags>

        <image_id_list>
            <image_id>0</image_id>
        </image_id_list>

        <root_cert_hash_list>
            <root_cert_hash>0000000000000000000000000000000000000000000000000000000000000000</root_cert_hash>
        </root_cert_hash_list>

        <elf>
            <elf_class>32</elf_class>
            <phys_addr>866FA000</phys_addr>
        </elf>
    </file_properties>
</tns:debugpolicy>
